Question,Answer
When would my Spot instance get interrupted?,"Over the last 3 months, 92% of Spot instance interruptions were from a customer manually terminating the instance because the application had completed its work.
In the circumstance EC2 needs to reclaim your Spot instance it can be for two possible reasons, with the primary one being Amazon EC2 capacity requirements (e.g. On Demand or Reserved Instance usage). Secondarily, if you have chosen to set a “maximum Spot price” and the Spot price rises above this, your instance will be reclaimed with a two-minute notification. This parameter determines the maximum price you would be willing to pay for a Spot instance hour, and by default, is set at the On-Demand price. As before, you continue to pay the Spot market price, not your maximum price, at the time your instance was running, charged in per-second increments."
What happens to my Spot instance when it gets interrupted?,"You can choose to have your Spot instances terminated, stopped or hibernated upon interruption. Stop and hibernate options are available for persistent Spot requests and Spot Fleets with the “maintain” option enabled. By default, your instances are terminated.
Refer to 
Spot Hibernation
 to learn more about handling interruptions."
What is the difference between Stop and Hibernate interruption behaviors?,"In the case of Hibernate, your instance gets hibernated and the RAM data persisted. In the case of Stop, your instance gets shutdown and RAM is cleared.
 In both the cases, data from your EBS root volume and any attached EBS data volumes is persisted. Your private IP address remains the same, as does your elastic IP address (if applicable). The network layer behavior will be similar to that of 
EC2 Stop-Start workflow
. Stop and Hibernate are available for Amazon EBS backed instances only. Local instance storage is not persisted."
What if my EBS root volume is not large enough to store memory state (RAM) for Hibernate?,"You should have sufficient space available on your EBS root volume to write data from memory. If the EBS root volume does not enough space, hibernation will fail and the instance will get shutdown instead. Ensure that your EBS volume is large enough to persist memory data before choosing the hibernate option."
What is the benefit if Spot hibernates my instance on interruption?,"With hibernate, Spot instances will pause and resume around any interruptions so your workloads can pick up from exactly where they left off. You can use hibernation when your instance(s) need to retain instance state across shutdown-startup cycles, i.e. when your applications running on Spot depend on contextual, business, or session data stored in RAM."
What do I need to do to enable hibernation for my Spot instances?,"Refer to 
Spot Hibernation
 to learn about enabling hibernation for your Spot instances."
Do I have to pay for hibernating my Spot instance?,There is no additional charge for hibernating your instance beyond the EBS storage costs and any other EC2 resources you may be using. You are not charged instance usage fees once your instance is hibernated.
Can I restart a stopped instance or resume a hibernated instance?,"No, you will not be able to re-start a stopped instance or resume a hibernated instance directly. Stop-start and hibernate-resume cycles are controlled by Amazon EC2. If an instance is stopped or hibernated by Spot, it will be restarted or resumed by Amazon EC2 when the capacity becomes available."
Which instances and operating systems support hibernation?,"Spot Hibernation is currently supported for Amazon Linux AMIs, Ubuntu and Microsoft Windows operating systems running on any instance type across C3, C4, C5, M4, M5, R3, R4 instances with memory (RAM) size less than 100 GiB.
To review the list of supported OS versions, refer to 
Spot Hibernation
."
How will I be charged if my Spot instance is interrupted?,"If your Spot instance is terminated or stopped by Amazon EC2 in the first instance hour, you will not be charged for that usage. However, if you terminate the instance yourself, you will be charged to the nearest second. If the Spot instance is terminated or stopped by Amazon EC2 in any subsequent hour, you will be charged for your usage to the nearest second. If you are running on Windows and you terminate the instance yourself, you will be charged for an entire hour."
How am I charged if Spot price changes while my instance is running? ,"You will pay the price per instance-hour set at the beginning of each instance-hour for the entire hour, billed to the nearest second."
Where can I see my usage history for Spot instances and see how much I was billed?,The AWS Management Console makes a detailed billing report available which shows Spot instance start and termination/stop times for all instances. Customers can check the billing report against historical Spot prices via the API to verify that the Spot price they were billed is correct.
 Are Spot blocks (Fixed Duration Spot instances) ever interrupted?,"Spot blocks are designed not to be interrupted and will run continuously for the duration you select, independent of Spot market price. In rare situations, Spot blocks may be interrupted due to AWS capacity needs. In these cases, we will provide a two-minute warning before we terminate your instance (
termination notice
), and you will not be charged for the affected instance(s)."
What is a Spot fleet?,"A Spot Fleet allows you to automatically request and manage multiple Spot instances that provide the lowest price per unit of capacity for your cluster or application, like a batch processing job, a Hadoop workflow, or an HPC grid computing job. You can include the instance types that your application can use. You define a target capacity based on your application needs (in units including instances, vCPUs, memory, storage, or network throughput) and update the target capacity after the fleet is launched. Spot fleets enable you to launch and maintain the target capacity, and to automatically request resources to replace any that are disrupted or manually terminated. 
Learn more about Spot fleets
."
Is there any additional charge for making Spot Fleet requests,"No, there is no additional charge for Spot Fleet requests."
 What limits apply to a Spot Fleet request?,"Visit the 
Spot Fleet Limits
 section of the Amazon EC2 User Guide to learn about the limits that apply to your Spot Fleet request."
 What happens if my Spot Fleet request tries to launch Spot instances but exceeds my regional Spot request limit?,"If your Spot Fleet request exceeds your regional Spot instance request limit, individual Spot instance requests will fail with a Spot request limit exceeded request status. Your Spot Fleet request’s history will show any Spot request limit errors that the Fleet request received. Visit the 
Monitoring Your Spot Fleet
 section of the Amazon EC2 User Guide to learn how to describe your Spot Fleet request's history."
 Are Spot fleet requests guaranteed to be fulfilled?,"No. Spot fleet requests allow you to place multiple Spot instance requests simultaneously, and are subject to the same availability and prices as a single Spot instance request. For example, if no resources are available for the instance types listed in your Spot Fleet request, we may be unable to fulfill your request partially or in full. We recommend you to include all the possible instance types and availability zones that are suitable for your workloads in the Spot Fleet."
 Can I submit a multi-Availability Zone Spot Fleet request?,"Yes, visit the 
Spot Fleet Examples
 section of the Amazon EC2 User Guide to learn how to submit a multi-Availability Zone Spot Fleet request."
 Can I submit a multi-region Spot Fleet request?,"No, we do not support multi-region Fleet requests."
How does Spot Fleet allocate resources across the various Spot instance pools specified in the launch specifications?,"The RequestSpotFleet API provides two allocation strategies: lowestPrice and diversified. The lowestPrice strategy allows you to provision your Spot Fleet resources in instance pools that provide the lowest price per unit of capacity at the time of the request. The diversified strategy allows you to provision your Spot Fleet resources across multiple Spot instance pools. This enables you to maintain your fleet’s target capacity and increase your application’s availability as Spot capacity fluctuates.
Running your application’s resources across diverse Spot instance pools also allows you to further reduce your fleet’s operating costs over time. Visit the 
Amazon EC2 User Guide
 to learn more."
Can I tag a Spot Fleet request?,You can request to launch Spot instances with tags via Spot Fleet. The Fleet by itself cannot be tagged.
How can I see which Spot fleet owns my Spot instances?,"You can identify the Spot instances associated with your Spot Fleet by describing your fleet request. Fleet requests are available for 48 hours after all its Spot instances have been terminated. See the 
Amazon EC2 User Guide
 to learn how to describe your Spot Fleet request."
Can I modify my Spot Fleet request?,"Yes, you can modify the target capacity of your Spot Fleet request. You may need to cancel the request and submit a new one to change other request configuration parameters."
Can I specify a different AMI for each instance type that I want to use?,"Yes, simply specify the AMI you’d like to use in each launch specification you provide in your Spot Fleet request."
"Can I use Spot Fleet with Elastic Load Balancing, Auto Scaling, or Elastic MapReduce?","You can use Auto Scaling features with Spot Fleet such as target tracking, health checks, cloudwatch metrics etc and can attach instances to your Elastic load balancers (both classic and application load balancers). Elastic MapReduce has a feature named “Instance fleets” that provides capabilities similar to Spot Fleet."
Does a Spot Fleet request terminate Spot instances when they are no longer running in the lowest priced Spot pools and relaunch them in the lowest priced pools?,"No, Spot Fleet requests do not automatically terminate and re-launch instances while they are running. However, if you terminate a Spot instance, Spot Fleet will replenish it with a new Spot instance in the new lowest priced pool."
Can I use stop or Hibernation interruption behaviors with Spot Fleet?,"Yes, stop-start and hibernate-resume are supported with Spot Fleet with “maintain” fleet option enabled."
How much compute power do Micro instances provide?,"Micro instances provide a small amount of consistent CPU resources and allow you to burst CPU capacity up to 2 ECUs when additional cycles are available. They are well suited for lower throughput applications and web sites that consume significant compute cycles periodically but very little CPU at other times for background processes, daemons, etc. 
Learn more
 about use of this instance type."
How does a Micro instance compare in compute power to a Standard Small instance?,"At steady state, Micro instances receive a fraction of the compute resources that Small instances do. Therefore, if your application has compute-intensive or steady state needs we recommend using a Small instance (or larger, depending on your needs). However, Micro instances can periodically burst up to 2 ECUs (for short periods of time). This is double the number of ECUs available from a Standard Small instance. Therefore, if you have a relatively low throughput application or web site with an occasional need to consume significant compute cycles, we recommend using Micro instances."
How can I tell if an application needs more CPU resources than a Micro instance is providing?,The CloudWatch metric for CPU utilization will report 100% utilization if the instance bursts so much that it exceeds its available CPU resources during that CloudWatch monitored minute. CloudWatch reporting 100% CPU utilization is your signal that you should consider scaling – manually or via Auto Scaling – up to a larger instance type or scale out to multiple Micro instances.
Are all features of Amazon EC2 available for Micro instances?,Currently Amazon DevPay is not available for Micro instances.
When should I use Compute Optimized instances?,"Compute Optimized instances are designed for applications that benefit from high compute power. These applications include compute-intensive applications like high-performance web servers, high-performance computing (HPC), scientific modelling, distributed analytics and machine learning inference."
Can I launch C4 instances as Amazon EBS-optimized instances?,"Each C4 instance type is EBS-optimized by default. C4 instances 500 Mbps to 4,000 Mbps to EBS above and beyond the general-purpose network throughput provided to the instance. Since this feature is always enabled on C4 instances, launching a C4 instance explicitly as EBS-optimized will not affect the instance's behavior."
How can I use the processor state control feature available on the c4.8xlarge instance?,"The c4.8xlarge instance type provides the ability for an operating system to control processor C-states and P-states. This feature is currently available only on Linux instances. You may want to change C-state or P-state settings to increase processor performance consistency, reduce latency, or tune your instance for a specific workload. By default, Amazon Linux provides the highest-performance configuration that is optimal for most customer workloads; however, if your application would benefit from lower latency at the cost of higher single- or dual-core frequencies, or from lower-frequency sustained performance as opposed to bursty Turbo Boost frequencies, then you should consider experimenting with the C-state or P-state configuration options that are available to these instances. For additional information on this feature, see the Amazon EC2 User Guide section on 
Processor State Control
."
Which instances are available within Compute Optimized instances category?,"C5 instances
: C5 instances are the latest generation of EC2 Compute Optimized instances. C5 instances are based on Intel Xeon Platinum processors, part of the Intel Xeon Scalable (codenamed Skylake-SP) processor family, and are available in 6 sizes and offer up to 72 vCPUs and 144 GiB memory. C5 instances deliver 25% improvement in price/performance compared to C4 instances.
C4 instances
: C4 instances are based on Intel Xeon E5-2666 v3 (codenamed Haswell) processors. C4 instances are available in 5 sizes and offer up to 36 vCPUs and 60 GiB memory."
Should I move my workloads from C3 or C4 instances to C5 instances?,"The generational improvement in CPU performance and lower price of C5 instances, which combined result in a 25% price/performance improvement relative to C4 instances, benefit a broad spectrum of workloads that currently run on C3 or C4 instances. For floating point intensive applications, Intel AVX-512 enables significant improvements in delivered TFLOPS by effectively extracting data level parallelism. Customers looking for absolute performance for graphics rendering and HPC workloads that can be accelerated with GPUs or FPGAs should also evaluate other instance families in the Amazon EC2 portfolio that include those resources to find the ideal instance for their workload."
Which operating systems/AMIs are supported on C5 Instances?,"EBS backed HVM AMIs with support for ENA networking and booting from NVMe-based storage can be used with C5 instances. The following AMIs are supported on C5:
Amazon Linux 2014.03 or newer
Ubuntu 14.04 or newer
SUSE Linux Enterprise Server 12 or newer
Red Hat Enterprise Linux 7.4 or newer
CentOS 7 or newer
Windows Server 2008 R2
Windows Server 2012
Windows Server 2012 R2
Windows Server 2016
FreeBSD 11.1-RELEASE
For optimal local NVMe-based SSD storage performance on C5d, Linux kernel version 4.9+ is recommended."
What are the storage options available to C5 customers?,"C5 instances use EBS volumes for storage, are EBS-optimized by default, and offer up to 9 Gbps throughput to both encrypted and unencrypted EBS volumes. C5 instances access EBS volumes via PCI attached NVM Express (NVMe) interfaces. NVMe is an efficient and scalable storage interface commonly used for flash based SSDs such as local NVMe storage provided with I3 instances. Though the NVMe interface may provide lower latency compared to Xen paravirtualized block devices, when used to access EBS volumes the volume type, size, and provisioned IOPS (if applicable) will determine the overall latency and throughput characteristics of the volume. When NVMe is used to provide EBS volumes, they are attached and detached by PCI hotplug."
What network interface is supported on C5 instances?,"C5 instances use the Elastic Network Adapter (ENA) for networking and enable Enhanced Networking by default. With ENA, C5 instances can utilize up to 25 Gbps of network bandwidth."
Which storage interface is supported on C5 instances?,C5 instances will support only NVMe EBS device model. EBS volumes attached to C5 instances will appear as NVMe devices. NVMe is a modern storage interface that provides latency reduction and results in increased disk I/O and throughput.
How many EBS volumes can be attached to C5 instances?,"C5 instances support a maximum for 27 EBS volumes for all Operating systems. The limit is shared with ENI attachments which can be found here http://docs.aws.amazon.com/AWSEC2/latest/UserGuide/using-eni.html. For example: since every instance has at least 1 ENI, if you have 3 additional ENI attachments on the c4.2xlarge, you can attach 24 EBS volumes to that instance."
What is the underlying hypervisor on C5 instances?,C5 instances use a new EC2 hypervisor that is based on core KVM technology.
Why does the total memory reported by Linux not match the advertised memory of the C5 instance type?,"In C5, portions of the total memory for an instance are reserved from use by the Operating System including areas used by the virtual BIOS for things like ACPI tables and for devices like the virtual video RAM."
What are Accelerated Computing instances?,"Accelerated Computing instance family is a family of instances which use hardware accelerators, or co-processors, to perform some functions, such as floating-point number calculation and graphics processing, more efficiently than is possible in software running on CPUs. Amazon EC2 provides three types of Accelerated Computing instances – GPU compute instances for general-purpose computing, GPU graphics instances for graphics intensive applications, and FPGA programmable hardware compute instances for advanced scientific workloads."
When should I use GPU Graphics and Compute instances?,"GPU instances work best for applications with massive parallelism such as workloads using thousands of threads. Graphics processing is an example with huge computational requirements, where each of the tasks is relatively small, the set of operations performed form a pipeline, and the throughput of this pipeline is more important than the latency of the individual operations. To be able build applications that exploit this level of parallelism, one needs GPU device specific knowledge by understanding how to program against various graphics APIs (DirectX, OpenGL) or GPU compute programming models (CUDA, OpenCL)."
How are P3 instances different from G3 instances?,"P3 instances are the next-generation of EC2 general-purpose GPU computing instances, powered by up to 8 of the latest-generation NVIDIA Tesla V100 GPUs. These new instances significantly improve performance and scalability, and add many new features, including new Streaming Multiprocessor (SM) architecture for machine learning (ML)/deep learning (DL) performance optimization, second-generation NVIDIA NVLink high-speed GPU interconnect, and highly tuned HBM2 memory for higher-efficiency.
G3 instances use NVIDIA Tesla M60 GPUs and provide a high-performance platform for graphics applications using DirectX or OpenGL. NVIDIA Tesla M60 GPUs support NVIDIA GRID Virtual Workstation features, and H.265 (HEVC) hardware encoding. Each M60 GPU in G3 instances supports 4 monitors with resolutions up to 4096x2160, and is licensed to use NVIDIA GRID Virtual Workstation for one Concurrent Connected User. Example applications of G3 instances include 3D visualizations, graphics-intensive remote workstation, 3D rendering, application streaming, video encoding, and other server-side graphics workloads."
What are the benefits of NVIDIA Volta GV100 GPUs?,"The new NVIDIA Tesla V100 accelerator incorporates the powerful new Volta GV100 GPU. GV100 not only builds upon the advances of its predecessor, the Pascal GP100 GPU, it significantly improves performance and scalability, and adds many new features that improve programmability. These advances will supercharge HPC, data center, supercomputer, and deep learning systems and applications."
Who will benefit from P3 instances?,"P3 instances with their high computational performance will benefit users in artificial intelligence (AI), machine learning (ML), deep learning (DL) and high performance computing (HPC) applications. Users includes data scientists, data architects, data analysts, scientific researchers, ML engineers, IT managers and software developers. Key industries include transportation, energy/oil & gas, financial services (banking, insurance), healthcare, pharmaceutical, sciences, IT, retail, manufacturing, high-tech, transportation, government, academia, among many others."
What are some key use cases of P3 instances?,"P3 instance use GPUs to accelerate numerous deep learning systems and applications including autonomous vehicle platforms, speech, image, and text recognition systems, intelligent video analytics, molecular simulations, drug discovery, disease diagnosis, weather forecasting, big data analytics, financial modeling, robotics, factory automation, real-time language translation, online search optimizations, and personalized user recommendations, to name just a few."
Why should customers use GPU-powered Amazon P3 instances for AI/ML and HPC?,"GPU-based compute instances provide greater throughput and performance because they are designed for massively parallel processing using thousands of specialized cores per GPU, versus CPUs offering sequential processing with a few cores. In addition, developers have built hundreds of GPU-optimized scientific HPC applications such as quantum chemistry, molecular dynamics, meteorology, among many others. Research indicates that over 70% of the most popular HPC applications provide built-in support for GPUs."
Will P3 instances support EC2 Classic networking and Amazon VPC?,P3 instances will support VPC only.
How are G3 instances different from P2 instances?,"G3 instances use NVIDIA Tesla M60 GPUs and provide a high-performance platform for graphics applications using DirectX or OpenGL. NVIDIA Tesla M60 GPUs support NVIDIA GRID Virtual Workstation features, and H.265 (HEVC) hardware encoding. Each M60 GPU in G3 instances supports 4 monitors with resolutions up to 4096x2160, and is licensed to use NVIDIA GRID Virtual Workstation for one Concurrent Connected User. Example applications of G3 instances include 3D visualizations, graphics-intensive remote workstation, 3D rendering, application streaming, video encoding, and other server-side graphics workloads.
P2 instances use NVIDIA Tesla K80 GPUs and are designed for general purpose GPU computing using the CUDA or OpenCL programming models. P2 instances provide customers with high bandwidth 25 Gbps networking, powerful single and double precision floating-point capabilities, and error-correcting code (ECC) memory, making them ideal for deep learning, high performance databases, computational fluid dynamics, computational finance, seismic analysis, molecular modeling, genomics, rendering, and other server-side GPU compute workloads."
How are P3 instances different from G2 instances?,"P3 Instances are the next-generation of EC2 general-purpose GPU computing instances, powered by up to 8 of the latest-generation NVIDIA Volta GV100 GPUs. These new instances significantly improve performance and scalability and add many new features, including new Streaming Multiprocessor (SM) architecture, optimized for machine learning (ML)/deep learning (DL) performance, second-generation NVIDIA NVLink high-speed GPU interconnect, and highly tuned HBM2 memory for higher-efficiency.
P2 instances use NVIDIA Tesla K80 GPUs and are designed for general purpose GPU computing using the CUDA or OpenCL programming models. P2 instances provide customers with high bandwidth 25 Gbps networking, powerful single and double precision floating-point capabilities, and error-correcting code (ECC) memory."
What APIs and programming models are supported by GPU Graphics and Compute instances?,"P3 instances support CUDA 9 and OpenCL, P2 instances support CUDA 8 and OpenCL 1.2 and G3 instances support DirectX 12, OpenGL 4.5, CUDA 8, and OpenCL 1.2."
Where do I get NVIDIA drivers for P3 and G3 instances?,"There are two methods by which NVIDIA drivers may be obtained. There are listings on the 
AWS Marketplace
 which offer Amazon Linux AMIs and Windows Server AMIs with the NVIDIA drivers pre-installed. You may also launch 64-bit, HVM AMIs and install the drivers yourself. You must visit the NVIDIA driver website and search for the NVIDIA Tesla V100 for P3, NVIDIA Tesla K80 for P2, and NVIDIA Tesla M60 for G3 instances."
"Which AMIs can I use with P3, P2 and G3 instances?","You can currently use Windows Server, SUSE Enterprise Linux, Ubuntu, and Amazon Linux AMIs on P2 and G3 instances. P3 instances only support HVM AMIs. If you want to launch AMIs with operating systems not listed here, contact AWS 
Customer Support
 with your request or reach out through 
EC2 Forums
."
