Question,Answer
What is Amazon Elastic Compute Cloud (Amazon EC2)?,"Amazon Elastic Compute Cloud (Amazon EC2) is a web service that provides resizable compute capacity in 
the cloud
. It is designed to make web-scale computing easier for developers."
What can I do with Amazon EC2?,"Just as Amazon Simple Storage Service (Amazon S3) enables storage in the cloud, Amazon EC2 enables “compute” in the cloud. Amazon EC2’s simple web service interface allows you to obtain and configure capacity with minimal friction. It provides you with complete control of your computing resources and lets you run on Amazon’s proven computing environment. Amazon EC2 reduces the time required to obtain and boot new server instances to minutes, allowing you to quickly scale capacity, both up and down, as your computing requirements change. Amazon EC2 changes the economics of computing by allowing you to pay only for capacity that you actually use."
How can I get started with Amazon EC2?,"To sign up for Amazon EC2, click the “Sign up for This Web Service” button on the Amazon EC2 detail page. You must have an Amazon Web Services account to access this service; if you do not already have one, you will be prompted to create one when you begin the Amazon EC2 sign-up process. After signing up, please refer to the 
Amazon EC2 documentation
, which includes our Getting Started Guide."
Why am I asked to verify my phone number when signing up for Amazon EC2?,Amazon EC2 registration requires you to have a valid phone number and email address on file with AWS in case we ever need to contact you. Verifying your phone number takes only a couple of minutes and involves receiving a phone call during the registration process and entering a PIN number using the phone key pad.
What can developers now do that they could not before?,"Until now, small developers did not have the capital to acquire massive compute resources and ensure they had the capacity they needed to handle unexpected spikes in load. Amazon EC2 enables any developer to leverage Amazon’s own benefits of massive scale with no up-front investment or performance compromises. Developers are now free to innovate knowing that no matter how successful their businesses become, it will be inexpensive and simple to ensure they have the compute capacity they need to meet their business requirements.
The “Elastic” nature of the service allows developers to instantly scale to meet spikes in traffic or demand. When computing requirements unexpectedly change (up or down), Amazon EC2 can instantly respond, meaning that developers have the ability to control how many resources are in use at any given point in time. In contrast, traditional hosting services generally provide a fixed number of resources for a fixed amount of time, meaning that users have a limited ability to easily respond when their usage is rapidly changing, unpredictable, or is known to experience large peaks at various intervals."
How do I run systems in the Amazon EC2 environment?,"Once you have set up your account and select or create your AMIs, you are ready to boot your instance. You can start your AMI on any number of On-Demand instances by using the RunInstances API call. You simply need to indicate how many instances you wish to launch. If you wish to run more than 20 On-Demand instances, complete the 
Amazon EC2 instance request form
.
If Amazon EC2 is able to fulfill your request, RunInstances will return success, and we will start launching your instances. You can check on the status of your instances using the DescribeInstances API call. You can also programmatically terminate any number of your instances using the TerminateInstances API call.
If you have a running instance using an Amazon EBS boot partition, you can also use the StopInstances API call to release the compute resources but preserve the data on the boot partition. You can use the StartInstances API when you are ready to restart the associated instance with the Amazon EBS boot partition.
In addition, you have the option to use Spot Instances to reduce your computing costs when you have flexibility in when your applications can run. Read more about Spot Instances for a more detailed explanation on how 
Spot Instances
 work.
If you prefer, you can also perform all these actions from the 
AWS Management Console
 or through the command line using our command line tools, which have been implemented with this web service API."
What is the difference between using the local instance store and Amazon Elastic Block Store (Amazon EBS) for the root device?,"When you launch your Amazon EC2 instances you have the ability to store your root device data on Amazon EBS or the local instance store. By using Amazon EBS, data on the root device will persist independently from the lifetime of the instance. This enables you to stop and restart the instance at a subsequent time, which is similar to shutting down your laptop and restarting it when you need it again.
Alternatively, the local instance store only persists during the life of the instance. This is an inexpensive way to launch instances where data is not stored to the root device. For example, some customers use this option to run large web sites where each instance is a clone to handle web traffic."
How quickly will systems be running?,"It typically takes less than 10 minutes from the issue of the RunInstances call to the point where all requested instances begin their boot sequences. This time depends on a number of factors including: the size of your AMI, the number of instances you are launching, and how recently you have launched that AMI. Images launched for the first time may take slightly longer to boot."
How do I load and store my systems with Amazon EC2?,"Amazon EC2 allows you to set up and configure everything about your instances from your operating system up to your applications. An Amazon Machine Image (AMI) is simply a packaged-up environment that includes all the necessary bits to set up and boot your instance. Your AMIs are your unit of deployment. You might have just one AMI or you might compose your system out of several building block AMIs (e.g., webservers, appservers, and databases). Amazon EC2 provides a number of tools to make creating an AMI easy. Once you create a custom AMI, you will need to bundle it. If you are bundling an image with a root device backed by Amazon EBS, you can simply use the bundle command in the AWS Management Console. If you are bundling an image with a boot partition on the instance store, then you will need to use the AMI Tools to upload it to Amazon S3. Amazon EC2 uses Amazon EBS and Amazon S3 to provide reliable, scalable storage of your AMIs so that we can boot them when you ask us to do so.
Or, if you want, you don’t have to set up your own AMI from scratch. You can choose from a number of globally available AMIs that provide useful instances. For example, if you just want a simple Linux server, you can choose one of the standard Linux distribution AMIs."
How do I access my systems?,"The RunInstances call that initiates execution of your application stack will return a set of DNS names, one for each system that is being booted. This name can be used to access the system exactly as you would if it were in your own data center. You own that machine while your operating system stack is executing on it."
Is Amazon EC2 used in conjunction with Amazon S3?,"Yes, Amazon EC2 is used jointly with Amazon S3 for instances with root devices backed by local instance storage. By using Amazon S3, developers have access to the same highly scalable, reliable, fast, inexpensive data storage infrastructure that Amazon uses to run its own global network of web sites. In order to execute systems in the Amazon EC2 environment, developers use the tools provided to load their AMIs into Amazon S3 and to move them between Amazon S3 and Amazon EC2. See 
How do I load and store my systems with Amazon EC2?
 for more information about AMIs.
We expect developers to find the combination of Amazon EC2 and Amazon S3 to be very useful. Amazon EC2 provides cheap, scalable compute in the cloud while Amazon S3 allows users to store their data reliably."
How many instances can I run in Amazon EC2?,"You are limited to running up to a total of 20 On-Demand instances across the instance family, purchasing 20 Reserved Instances, and requesting Spot Instances per your 
dynamic Spot limit
 per region. New AWS accounts may start with limits that are lower than the limits described here. Certain instance types are further limited per region as follows:
Note that cc2.8xlarge, hs1.8xlarge, cr1.8xlarge, G2, D2, and I2 instances are not available in all regions.
If you need more instances, complete the 
Amazon EC2 instance request form
 with your use case and your instance increase will be considered. Limit increases are tied to the region they were requested for."
Are there any limitations in sending email from Amazon EC2 instances?,"Yes. In order to maintain the quality of Amazon EC2 addresses for sending email, we enforce default limits on the amount of email that can be sent from EC2 accounts. If you wish to send larger amounts of email from EC2, you can apply to have these limits removed from your account by 
filling out this form
."
How quickly can I scale my capacity both up and down?,"Amazon EC2 provides a truly elastic computing environment. Amazon EC2 enables you to increase or decrease capacity within minutes, not hours or days. You can commission one, hundreds or even thousands of server instances simultaneously. When you need more instances, you simply call RunInstances, and Amazon EC2 will typically set up your new instances in a matter of minutes. Of course, because this is all controlled with web service APIs, your application can automatically scale itself up and down depending on its needs."
What operating system environments are supported?,"Amazon EC2 currently supports a variety of operating systems including: Amazon Linux, Ubuntu, Windows Server, Red Hat Enterprise Linux, SUSE Linux Enterprise Server, Fedora, Debian, CentOS, Gentoo Linux, Oracle Linux, and FreeBSD. We are looking for ways to expand it to other platforms."
Does Amazon EC2 use ECC memory?,"In our experience, ECC memory is necessary for server infrastructure, and all the hardware underlying Amazon EC2 uses ECC memory."
How is this service different than a plain hosting service?,"Traditional hosting services generally provide a pre-configured resource for a fixed amount of time and at a predetermined cost. Amazon EC2 differs fundamentally in the flexibility, control and significant cost savings it offers developers, allowing them to treat Amazon EC2 as their own personal data center with the benefit of Amazon.com’s robust infrastructure.
When computing requirements unexpectedly change (up or down), Amazon EC2 can instantly respond, meaning that developers have the ability to control how many resources are in use at any given point in time. In contrast, traditional hosting services generally provide a fixed number of resources for a fixed amount of time, meaning that users have a limited ability to easily respond when their usage is rapidly changing, unpredictable, or is known to experience large peaks at various intervals.
Secondly, many hosting services don’t provide full control over the compute resources being provided. Using Amazon EC2, developers can choose not only to initiate or shut down instances at any time, they can completely customize the configuration of their instances to suit their needs – and change it at any time. Most hosting services cater more towards groups of users with similar system requirements, and so offer limited ability to change these.
Finally, with Amazon EC2 developers enjoy the benefit of paying only for their actual resource consumption – and at very low rates. Most hosting services require users to pay a fixed, up-front fee irrespective of their actual computing power used, and so users risk overbuying resources to compensate for the inability to quickly scale up resources within a short time frame."
How will I be charged and billed for my use of Amazon EC2?,"You pay only for what you use. Displayed pricing is an hourly rate but depending on which instances you choose, you pay by the hour or second (minimum of 60 seconds) for each instance type. Partial instance-hours consumed are billed based on instance usage. Data transferred between AWS services in different regions will be charged as Internet Data Transfer on both sides of the transfer. Usage for other Amazon Web Services is billed separately from Amazon EC2.
For EC2 pricing information, please visit the 
pricing section on the EC2 detail page
."
When does billing of my Amazon EC2 systems begin and end?,"Billing commences when Amazon EC2 initiates the boot sequence of an AMI instance. Billing ends when the instance terminates, which could occur through a web services command, by running ""shutdown -h"", or through instance failure. When you stop an instance, we shut it down but don't charge hourly usage for a stopped instance, or data transfer fees, but we do charge for the storage for any Amazon EBS volumes. To learn more, visit the 
AWS Documentation
."
What defines billable EC2 instance usage?,"Instance usages are billed for any time your instances are in a ""running"" state. If you no longer wish to be charged for your instance, you must ""stop"" or ""terminate"" the instance to avoid being billed for additional instance usage. Billing starts when an instance transitions into the running state."
"If I have two instances in different availability zones, how will I be charged for regional data transfer?","Each instance is charged for its data in and data out at corresponding Data Transfer rates. Therefore, if data is transferred between these two instances, it is charged at ""Data Transfer Out from EC2 to Another AWS Region"" for the first instance and at ""Data Transfer In from Another AWS Region"" for the second instance. Please refer to 
this page
 for detailed data transfer."
"If I have two instances in different regions, how will I be charged for data transfer?","Each instance is charged for its data in and data out at Internet Data Transfer rates. Therefore, if data is transferred between these two instances, it is charged at Internet Data Transfer Out for the first instance and at Internet Data Transfer In for the second instance."
How will my monthly bill show per-second versus per-hour?,"Although EC2 charges in your monthly bill will now be calculated based on a per second basis, for consistency, the monthly EC2 bill will show cumulative usage for each instance that ran in a given month in decimal hours. An example would be an instance running for 1 hour 10 minutes and 4 seconds would look like 1.1677. Below is an example of a detailed billing report. The two highlighted areas show how the new report will look based on decimal hours."
Do your prices include taxes?,"Except as otherwise noted, our prices are exclusive of applicable taxes and duties, including VAT and applicable sales tax. For customers with a Japanese billing address, use of AWS services is subject to Japanese Consumption Tax. 
Learn more
."
What kind of hardware will my application stack run on?,"Visit 
Amazon EC2 Instance Type
 for a list of EC2 instances available by region."
How do I select the right instance type?,"Amazon EC2 instances are grouped into 5 families: General Purpose, Compute Optimized, Memory Optimized, Storage Optimized and Accelerated Computing instances. General Purpose Instances have memory to CPU ratios suitable for most general purpose applications and come with fixed performance (M5, M4) or burstable performance (T2); Compute Optimized instances (C5, C4) have proportionally more CPU resources than memory (RAM) and are well suited for scale out compute-intensive applications and High Performance Computing (HPC) workloads; Memory Optimized Instances (X1e, X1, R4) offer larger memory sizes for memory-intensive applications, including database and memory caching applications; Accelerating Computing instances (P3, P2, G3, F1) take advantage of the parallel processing capabilities of NVIDIA Tesla GPUs for high performance computing and machine/deep learning; GPU Graphics instances (G3) offer high-performance 3D graphics capabilities for applications using OpenGL and DirectX; F1 instances deliver Xilinx FPGA-based reconfigurable computing; Storage Optimized Instances (H1, I3, D2) that provide very high, low latency, I/O capacity using SSD-based local instance storage for I/O-intensive applications, with D2 or H1, the dense-storage and HDD-storage instances, provide local high storage density and sequential I/O performance for data warehousing, Hadoop and other data-intensive applications. When choosing instance types, you should consider the characteristics of your application with regards to resource utilization (i.e. CPU, Memory, Storage) and select the optimal instance family and instance size."
What is an “EC2 Compute Unit” and why did you introduce it?,"Transitioning to a utility computing model fundamentally changes how developers have been trained to think about CPU resources. Instead of purchasing or leasing a particular processor to use for several months or years, you are renting capacity by the hour. Because Amazon EC2 is built on commodity hardware, over time there may be several different types of physical hardware underlying EC2 instances. Our goal is to provide a consistent amount of CPU capacity no matter what the actual underlying hardware.
Amazon EC2 uses a variety of measures to provide each instance with a consistent and predictable amount of CPU capacity. In order to make it easy for developers to compare CPU capacity between different instance types, we have defined an Amazon EC2 Compute Unit. The amount of CPU that is allocated to a particular instance is expressed in terms of these EC2 Compute Units. We use several benchmarks and tests to manage the consistency and predictability of the performance from an EC2 Compute Unit. The EC2 Compute Unit (ECU) provides the relative measure of the integer processing power of an Amazon EC2 instance. Over time, we may add or substitute measures that go into the definition of an EC2 Compute Unit, if we find metrics that will give you a clearer picture of compute capacity."
What is the regional availability of Amazon EC2 instance types?,"For a list of all instances and regional availability, visit 
Amazon EC2 Pricing."
How do I prevent other people from viewing my systems?,"You have complete control over the visibility of your systems. The Amazon EC2 security systems allow you to place your running instances into arbitrary groups of your choice. Using the web services interface, you can then specify which groups may communicate with which other groups, and also which IP subnets on the Internet may talk to which groups. This allows you to control access to your instances in our highly dynamic environment. Of course, you should also secure your instance as you would any other server."
Can I get a history of all EC2 API calls made on my account for security analysis and operational troubleshooting purposes? ,"Yes. To receive a history of all EC2 API calls (including VPC and EBS) made on your account, you simply turn on CloudTrail in the 
AWS Management Console
.  For more information, visit the 
CloudTrail
 home page."
Where can I find more information about security on AWS?,"For more information on security on AWS please refer to our 
Amazon Web Services: Overview of Security Processes
 white paper and to our 
Amazon EC2 running Windows Security Guide
."
Why am I limited to 5 Elastic IP addresses per region?,"Public (IPV4) internet addresses are a scarce resource. There is only a limited amount of public IP space available, and Amazon EC2 is committed to helping use that space efficiently.
By default, all accounts are limited to 5 Elastic IP addresses per region. If you need more the 5 Elastic IP addresses, we ask that you apply for your limit to be raised. We will ask you to think through your use case and help us understand your need for additional addresses. You can 
apply for more Elastic IP address here
. Any increases will be specific to the region they have been requested for."
Why am I charged when my Elastic IP address is not associated with a running instance?,"In order to help ensure our customers are efficiently using the Elastic IP addresses, we impose a small hourly charge for each address when it is not associated to a running instance."
Do I need one Elastic IP address for every instance that I have running?,"No. You do not need an Elastic IP address for all your instances. By default, every instance comes with a private IP address and an internet routable public IP address. The private address is associated exclusively with the instance and is only returned to Amazon EC2 when the instance is stopped or terminated. The public address is associated exclusively with the instance until it is stopped, terminated or replaced with an Elastic IP address. These IP addresses should be adequate for many applications where you do not need a long lived internet routable end point. Compute clusters, web crawling, and backend services are all examples of applications that typically do not require Elastic IP addresses."
How long does it take to remap an Elastic IP address?,The remap process currently takes several minutes from when you instruct us to remap the Elastic IP until it fully propagates through our system.
Can I configure the reverse DNS record for my Elastic IP address?,"Yes, you can configure the reverse DNS record of your Elastic IP address by 
filling out this form
. Note that a corresponding forward DNS record pointing to that Elastic IP address must exist before we can create the reverse DNS record."
How isolated are Availability Zones from one another?,"Each Availability Zone runs on its own physically distinct, independent infrastructure, and is engineered to be highly reliable. Common points of failures like generators and cooling equipment are not shared across Availability Zones. Additionally, they are physically separate, such that even extremely uncommon disasters such as fires, tornados or flooding would only affect a single Availability Zone."
Is Amazon EC2 running in more than one region?,"Yes. Please refer to 
Regional Products and Services
 for more details of our product and service availability by region."
How can I make sure that I am in the same Availability Zone as another developer?,"We do not currently support the ability to coordinate launches into the same Availability Zone across AWS developer accounts. One Availability Zone name (for example, us-east-1a) in two AWS customer accounts may relate to different physical Availability Zones."
"If I transfer data between Availability Zones using public IP addresses, will I be charged twice for Regional Data Transfer (once because it’s across zones, and a second time because I’m using public IP addresses)?","No. Regional Data Transfer rates apply if at least one of the following is true, but is only charged once for a given instance even if both are true:
The other instance is in a different Availability Zone, regardless of which type of address is used.
Public or Elastic IP addresses are used, regardless of which Availability Zone the other instance is in."
What is the Nitro Hypervisor?,"The launch of C5 instances introduced a new hypervisor for Amazon EC2, the Nitro Hypervisor. As a component of the Nitro system, the Nitro Hypervisor primarily provides CPU and memory isolation for EC2 instances. VPC networking and EBS storage resources are implemented by dedicated hardware components, Nitro Cards that are part of all current generation EC2 instance families. The Nitro Hypervisor is built on core Linux Kernel-based Virtual Machine (KVM) technology, but does not include general-purpose operating system components."
How does the Nitro Hypervisor benefit customers?,"The Nitro Hypervisor provides consistent performance and increased compute and memory resources for EC2 virtualized instances by removing host system software components. It allows AWS to offer larger instance sizes (like c5.18xlarge) that provide practically all of the resources from the server to customers. Previously, C3 and C4 instances each eliminated software components by moving VPC and EBS functionality to hardware designed and built by AWS. This hardware enables the Nitro Hypervisor to be very small and uninvolved in data processing tasks for networking and storage."
Will all EC2 instances use the Nitro Hypervisor?,"Eventually all new instance types will use the Nitro Hypervisor, but in the near term, some new instance types will use Xen depending on the requirements of the platform."
Will AWS continue to invest in its Xen-based hypervisor?,"Yes. As AWS expands its global cloud infrastructure, EC2’s use of its Xen-based hypervisor will also continue to grow. Xen will remain a core component of EC2 instances for the foreseeable future. AWS is a founding member of the Xen Project since its establishment as a Linux Foundation Collaborative Project and remains an active participant on its Advisory Board. As AWS expands its global cloud infrastructure, EC2’s Xen-based hypervisor also continues to grow. Therefore EC2’s investment in Xen continues to grow, not shrink"
